{
  "id": "disable-cortana",
  "name": "Deshabilitar Cortana",
  "description": "Deshabilita el asistente Cortana y su barra de búsqueda en la taskbar, liberando recursos y reduciendo distracciones.",
  "category": "startmenu-taskbar",
  "commands": {
    "apply": "New-Item -Path 'HKLM:\\SOFTWARE\\Policies\\Microsoft\\Windows\\Windows Search' -Force | Out-Null; Set-ItemProperty -Path 'HKLM:\\SOFTWARE\\Policies\\Microsoft\\Windows\\Windows Search' -Name 'AllowCortana' -Value 0 -Type DWord; Set-ItemProperty -Path 'HKLM:\\SOFTWARE\\Policies\\Microsoft\\Windows\\Windows Search' -Name 'DisableWebSearch' -Value 1 -Type DWord; Set-ItemProperty -Path 'HKLM:\\SOFTWARE\\Policies\\Microsoft\\Windows\\Windows Search' -Name 'ConnectedSearchUseWeb' -Value 0 -Type DWord",
    "revert": "Remove-ItemProperty -Path 'HKLM:\\SOFTWARE\\Policies\\Microsoft\\Windows\\Windows Search' -Name 'AllowCortana' -ErrorAction SilentlyContinue; Remove-ItemProperty -Path 'HKLM:\\SOFTWARE\\Policies\\Microsoft\\Windows\\Windows Search' -Name 'DisableWebSearch' -ErrorAction SilentlyContinue; Remove-ItemProperty -Path 'HKLM:\\SOFTWARE\\Policies\\Microsoft\\Windows\\Windows Search' -Name 'ConnectedSearchUseWeb' -ErrorAction SilentlyContinue"
  },
  "risk": "medium",
  "reversible": true,
  "compatible_with_vanguard": true,
  "requires_restart": false,
  "tags": ["cortana", "search", "startmenu", "taskbar", "privacy"]
}
