{
  "id": "disable-widgets",
  "name": "Deshabilitar Widgets",
  "description": "Deshabilita el panel de Widgets de Windows 11 que consume recursos y bandwidth en segundo plano.",
  "category": "startmenu-taskbar",
  "commands": {
    "apply": "New-Item -Path 'HKLM:\\SOFTWARE\\Policies\\Microsoft\\Dsh' -Force | Out-Null; Set-ItemProperty -Path 'HKLM:\\SOFTWARE\\Policies\\Microsoft\\Dsh' -Name 'AllowNewsAndInterests' -Value 0 -Type DWord; Set-ItemProperty -Path 'HKCU:\\SOFTWARE\\Policies\\Microsoft\\Windows\\Explorer' -Name 'DisableWidgets' -Value 1 -Type DWord",
    "revert": "Remove-ItemProperty -Path 'HKLM:\\SOFTWARE\\Policies\\Microsoft\\Dsh' -Name 'AllowNewsAndInterests' -ErrorAction SilentlyContinue; Remove-ItemProperty -Path 'HKCU:\\SOFTWARE\\Policies\\Microsoft\\Windows\\Explorer' -Name 'DisableWidgets' -ErrorAction SilentlyContinue"
  },
  "risk": "low",
  "reversible": true,
  "compatible_with_vanguard": true,
  "requires_restart": false,
  "tags": ["widgets", "startmenu", "taskbar", "privacy"]
}
