{
  "id": "disable-telemetry",
  "name": "Deshabilitar Telemetría de Windows",
  "description": "Desactiva la recopilación de telemetría y datos de diagnóstico de Windows, reduciendo el uso de red y CPU en segundo plano.",
  "category": "privacy",
  "commands": {
    "apply": "Set-ItemProperty -Path 'HKLM:\\SOFTWARE\\Microsoft\\Windows\\CurrentVersion\\Policies\\DataCollection' -Name 'AllowTelemetry' -Value 0 -Type DWord; Set-ItemProperty -Path 'HKLM:\\SOFTWARE\\Policies\\Microsoft\\Windows\\DataCollection' -Name 'AllowTelemetry' -Value 0 -Type DWord; Stop-Service -Name 'DiagTrack' -Force -ErrorAction SilentlyContinue; Set-Service -Name 'DiagTrack' -StartupType Disabled; Stop-Service -Name 'dmwappushservice' -Force -ErrorAction SilentlyContinue; Set-Service -Name 'dmwappushservice' -StartupType Disabled",
    "revert": "Remove-ItemProperty -Path 'HKLM:\\SOFTWARE\\Microsoft\\Windows\\CurrentVersion\\Policies\\DataCollection' -Name 'AllowTelemetry' -ErrorAction SilentlyContinue; Remove-ItemProperty -Path 'HKLM:\\SOFTWARE\\Policies\\Microsoft\\Windows\\DataCollection' -Name 'AllowTelemetry' -ErrorAction SilentlyContinue; Set-Service -Name 'DiagTrack' -StartupType Automatic; Start-Service -Name 'DiagTrack' -ErrorAction SilentlyContinue; Set-Service -Name 'dmwappushservice' -StartupType Automatic; Start-Service -Name 'dmwappushservice' -ErrorAction SilentlyContinue"
  },
  "risk": "medium",
  "reversible": true,
  "compatible_with_vanguard": true,
  "requires_restart": false,
  "tags": ["telemetry", "privacy", "background"]
}
